<?xml version="1.0" encoding="UTF-8"?>
<tns:contacts xmlns:tns="http://www.homework.org/contacts" xmlns:xsi="http://www.w3.org/2001/XMLSchema-instance" xsi:schemaLocation="http://www.homework.org/contacts contact.xsd ">
  <tns:contact>
    <tns:ID>0</tns:ID>
    <tns:name>
      <tns:firstName>tns:firstName</tns:firstName>
      <tns:lastName>tns:lastName</tns:lastName>
    </tns:name>
  </tns:contact>
  <tns:address>
    <tns:contactID>0</tns:contactID>
    <tns:address>
      <tns:number>tns:number</tns:number>
      <tns:street>tns:street</tns:street>
      <tns:city>tns:city</tns:city>
      <tns:state>tns:state</tns:state>
    </tns:address>
  </tns:address>
  <tns:phone>
    <tns:contactID>0</tns:contactID>
    <tns:number>tns:number</tns:number>
  </tns:phone>
</tns:contacts>
